<?xml version="1.0" encoding="UTF-8" ?>

<exam xmlns="https://vpt1.org"
      xmlns:xsi="http://www.w3.org/2001/XMLSchema-instance"
      xsi:schemaLocation="https://vpt1.org questions.xsd">
    <head>
        <title>Test Question Catalog</title>
        <version>1.0</version>
        <id>1337</id>
    </head>
    <body>
        <question type="extended-answer" id="0">
            <body>Reg-Ex Test Question: What is the meaning of life? (Answers: 42, fourty-two)</body>
            <answers>
                <answer>
                    <body>42</body>
                    <marks>
                        <mark type="regex">
                            42|fourty[\s-]two
                        </mark>
                    </marks>
                </answer>
            </answers>
        </question>
        <question type="extended-answer" id="1">
            <body>Keyword Question: What is the name of your university?</body>
            <answers>
                <answer>
                    <body>Technische Universit채t M체nchen</body>
                    <marks>
                        <mark type="keyword" points="1">
                            technische
                        </mark>
                        <mark type="keyword" points="1">
                            universit채t
                        </mark>
                        <mark type="keyword" points="1">
                            m체nchen
                        </mark>
                    </marks>
                </answer>
            </answers>
        </question>
    </body>
</exam>